{
  "lane": "anthropic",
  "intended_model": "claude-fable-5",
  "actual_model": "claude-opus-4-8",
  "effort": "max",
  "degradation": "claude-fable-5 was unavailable; approved direct fallback claude-opus-4-8 served the assessment",
  "skill_commit": "d4846045a1e4079676e5ea539af7db8bfa8c3c9e",
  "ari_commit": "847f5e300d1977be9a437ead50826ddd5930a01d",
  "baseline_commit": "a634d948038f502e5e677477138dca0c763e2380",
  "final_commit": "950c0c44bfea54f4a7706ff99eb10ccf11127597",
  "delta_scope": 10.779556650246302,
  "delta_controls": -20.310344827586203,
  "old": {
    "label": "old",
    "ari": 28.392857142857142,
    "risk_mass": 7.95,
    "risk_capacity": 28,
    "band_grade": "C",
    "grade": "C",
    "severity_gate_grade_cap": "C",
    "threats": [
      {
        "id": "T1",
        "title": "Credentialed execution over untrusted code (YOLO agent)",
        "severity": "High",
        "weight": 5,
        "controls": [
          {
            "id": "C1",
            "title": "Pre-launch prompt review + two-layer agent env allowlist & controller-capability withholding (consolidated pre-execution / blast-radius hygiene; correlated — none constrain runtime exfiltration of the in-process active provider credential over open egress)",
            "status": "Partial",
            "effectiveness": null,
            "effectiveness_rationale": null,
            "independence_group": "t1-preexecution-blast-radius-hygiene"
          },
          {
            "id": "C13",
            "title": "Sandbox network-egress allowlist / hold active credential outside the agent-reachable env (accepted residual)",
            "status": "Not Applied",
            "effectiveness": null,
            "effectiveness_rationale": null,
            "independence_group": null
          }
        ],
        "gap": 0.5,
        "residual_mass": 2.5
      },
      {
        "id": "T2",
        "title": "Malicious committed prompt / topology / references change",
        "severity": "Medium",
        "weight": 3,
        "controls": [
          {
            "id": "C1",
            "title": "Human prompt review before launch",
            "status": "Partial",
            "effectiveness": null,
            "effectiveness_rationale": null,
            "independence_group": "human-prompt-review"
          },
          {
            "id": "C3",
            "title": "Production-source fail-closed workspace handoff",
            "status": "Applied",
            "effectiveness": null,
            "effectiveness_rationale": null,
            "independence_group": "production-source-guard"
          },
          {
            "id": "C9",
            "title": "SHA-pinned references + sealed content-addressed controls",
            "status": "Applied",
            "effectiveness": null,
            "effectiveness_rationale": null,
            "independence_group": "reference-pinning"
          }
        ],
        "gap": 0.03,
        "residual_mass": 0.09
      },
      {
        "id": "T3",
        "title": "Secret leakage via artifacts",
        "severity": "Medium",
        "weight": 3,
        "controls": [
          {
            "id": "C6",
            "title": "Consolidated baseline artifact-secret posture: secret redaction (logs/events/diagnostics) + explicit artifact materialization sensitive-destination block (correlated — neither scrubs persisted artifact bodies nor recognizes 0x-64-hex private-key / BIP-39 mnemonic formats)",
            "status": "Partial",
            "effectiveness": null,
            "effectiveness_rationale": null,
            "independence_group": "t3-artifact-secret-posture"
          }
        ],
        "gap": 0.5,
        "residual_mass": 1.5
      },
      {
        "id": "T4",
        "title": "Target-code confidentiality to third-party providers",
        "severity": "Medium",
        "weight": 3,
        "controls": [
          {
            "id": "C21",
            "title": "Reconstructed implicit provider-selection confidentiality posture (prior-lane judgment; encoded to reproduce the published baseline 0.50)",
            "status": "Partial",
            "effectiveness": null,
            "effectiveness_rationale": null,
            "independence_group": "provider-selection-posture"
          },
          {
            "id": "C22",
            "title": "Third-party data-handling policy / local-model or OpenRouter allowlist",
            "status": "Not Applied",
            "effectiveness": null,
            "effectiveness_rationale": null,
            "independence_group": null
          }
        ],
        "gap": 0.5,
        "residual_mass": 1.5
      },
      {
        "id": "T5",
        "title": "File-write boundary escape",
        "severity": "Medium",
        "weight": 3,
        "controls": [
          {
            "id": "C2",
            "title": "Explicit artifact materialization (confirmation, source restriction, patch rejection)",
            "status": "Applied",
            "effectiveness": null,
            "effectiveness_rationale": null,
            "independence_group": "materialization-confirm"
          },
          {
            "id": "C3",
            "title": "Production-source fail-closed workspace handoff",
            "status": "Applied",
            "effectiveness": null,
            "effectiveness_rationale": null,
            "independence_group": "production-source-guard"
          },
          {
            "id": "C4",
            "title": "Canonical path policy + symlink/TOCTOU hardening",
            "status": "Applied",
            "effectiveness": null,
            "effectiveness_rationale": null,
            "independence_group": "path-canonicalization"
          }
        ],
        "gap": 0.03,
        "residual_mass": 0.09
      },
      {
        "id": "T6",
        "title": "Dashboard CSRF / DNS-rebind / co-resident local-process drive",
        "severity": "Low",
        "weight": 1,
        "controls": [
          {
            "id": "C7",
            "title": "Dashboard loopback network bind",
            "status": "Applied",
            "effectiveness": null,
            "effectiveness_rationale": null,
            "independence_group": "dashboard-loopback-network"
          },
          {
            "id": "C17",
            "title": "Dashboard Origin/sec-fetch-site checks + strict CSP + 1 MiB body caps",
            "status": "Applied",
            "effectiveness": null,
            "effectiveness_rationale": null,
            "independence_group": "dashboard-browser-policy"
          },
          {
            "id": "C18",
            "title": "Dashboard per-session constant-time mutation token (residual: GET /api/session discloses the token to any loopback caller; no run-launch confirmation)",
            "status": "Partial",
            "effectiveness": null,
            "effectiveness_rationale": null,
            "independence_group": "dashboard-session-capability"
          }
        ],
        "gap": 0.03,
        "residual_mass": 0.03
      },
      {
        "id": "T7",
        "title": "Supply-chain compromise (image, toolchain, references, submodules)",
        "severity": "Medium",
        "weight": 3,
        "controls": [
          {
            "id": "C11",
            "title": "Consolidated baseline supply-chain posture: SHA-pinned references + non-root pinned container + Modal Secrets + TTL judge credential (correlated OR-of-facets — dominant open facets: base-image mutable tag, unverified toolchain downloads, git-submodule protocol)",
            "status": "Partial",
            "effectiveness": null,
            "effectiveness_rationale": null,
            "independence_group": "t7-supplychain-posture"
          },
          {
            "id": "C23",
            "title": "Explicit git submodule protocol lockdown",
            "status": "Not Applied",
            "effectiveness": null,
            "effectiveness_rationale": null,
            "independence_group": null
          }
        ],
        "gap": 0.5,
        "residual_mass": 1.5
      },
      {
        "id": "T8",
        "title": "Public publication integrity (benchmark/eval-history)",
        "severity": "Low",
        "weight": 1,
        "controls": [
          {
            "id": "C10",
            "title": "Least-privilege CI + same-repo default-branch producer gate + scoped short-lived publisher token",
            "status": "Applied",
            "effectiveness": null,
            "effectiveness_rationale": null,
            "independence_group": "ci-producer-authorization"
          },
          {
            "id": "C20",
            "title": "Publication path allowlist + secret scrub + canonical-report equality",
            "status": "Applied",
            "effectiveness": null,
            "effectiveness_rationale": null,
            "independence_group": "ci-publication-content"
          }
        ],
        "gap": 0.04,
        "residual_mass": 0.04
      },
      {
        "id": "T9",
        "title": "Resource / cost exhaustion",
        "severity": "Low",
        "weight": 1,
        "controls": [
          {
            "id": "C12",
            "title": "Resource admission bounds (topology/suite/body/job/deadline caps); residual: eval-matrix expansion uncapped and intended model spend irreducible",
            "status": "Applied",
            "effectiveness": null,
            "effectiveness_rationale": null,
            "independence_group": "resource-admission-bounds"
          }
        ],
        "gap": 0.2,
        "residual_mass": 0.2
      },
      {
        "id": "T10",
        "title": "CI fork-PR secret exposure",
        "severity": "High",
        "weight": 5,
        "controls": [
          {
            "id": "C10",
            "title": "Fork-PR secret trigger gate (no pull_request_target; secrets gated to dispatch/push-main)",
            "status": "Applied",
            "effectiveness": null,
            "effectiveness_rationale": null,